question,answer
How are innovative business models and national policy support helping to overcome the high upfront costs that have traditionally hindered the adoption of geothermal heating?,ERROR_NO_RESULT
"Compare the scale, primary purpose, and funding mechanisms of the large-scale geothermal project in Kosice, Slovakia, with the distributed, urban approach of Diverso Energy in North America.",ERROR_NO_RESULT
"What role do government policies play in catalyzing the geothermal energy market, according to projects in both Slovakia and North America?",ERROR_NO_RESULT
"What were the key findings from BlueWave's agrivoltaics project in Maine regarding construction techniques and bifacial panels, and how do these inform future solar farm designs?",ERROR_NO_RESULT
How does the agrivoltaics project in Maine demonstrate the importance of collaboration between different stakeholders in the renewable energy sector?,ERROR_NO_RESULT
"Based on the Recurrent Energy project in Oklahoma and the trends in US solar shipments, what is the current state and trajectory of utility-scale solar power in the United States?",ERROR_NO_RESULT
"What are the advantages of floating solar technology as demonstrated by projects in the Philippines and Germany, and what challenges does the industry face?",ERROR_NO_RESULT
"How are software and new modeling approaches, as discussed by FTC Solar and Oak Ridge National Lab, improving the performance and reliability of solar energy and the broader grid?",ERROR_NO_RESULT
What are the key differences between the long-duration energy storage technologies being piloted by CMBlu Energy and those being researched at the Grid Storage Launchpad (GSL)?,ERROR_NO_RESULT
What is the significance of the Grid Storage Launchpad (GSL) and how will its work on digital twins and safety accelerate the deployment of grid-scale batteries?,ERROR_NO_RESULT
"How is the U.S. government supporting a transition to electric vehicles, specifically focusing on both manufacturing and consumer adoption?",ERROR_NO_RESULT
What are the primary challenges and corresponding solutions for deploying charging infrastructure for electric trucks?,ERROR_NO_RESULT
"How do the market dynamics for electric vehicles in Norway and Sweden differ, and what economic factors are influencing current sales trends?",ERROR_NO_RESULT
"What regulatory changes are being considered in Iowa to ensure a cost-effective and reliable transition to clean energy, and what are the advocates' main arguments?",ERROR_NO_RESULT
How is the U.S. Department of Energy addressing the dual challenges of expanding the national transmission grid and accelerating the permitting process for new lines?,ERROR_NO_RESULT
What do studies about marine heat waves and Antarctic ice shelves reveal about the complexities of predicting the impacts of climate change?,ERROR_NO_RESULT
"How can the integration of ""nature-based solutions"" in European cities contribute to achieving carbon neutrality?",ERROR_NO_RESULT
"What are the economic and learning curve factors that suggest renewable energy prices will continue to fall dramatically, according to RMI?",ERROR_NO_RESULT
"How is the concept of a ""utility model"" or ""as-a-service"" being applied in both the geothermal and electric mobility sectors to drive adoption?",ERROR_NO_RESULT
"Considering the projects in Slovakia, Oklahoma, and Maine, how does government funding at different levels (national, state, federal) catalyze specific types of renewable energy projects?",ERROR_NO_RESULT
"Beyond upfront costs, what are the other significant barriers to geothermal adoption mentioned in the interviews and reports, and what solutions are being implemented?",ERROR_NO_RESULT
How do the lifespan and environmental benefits of the geothermal systems described by Diverso Energy and the Kosice project contribute to their long-term value proposition?,ERROR_NO_RESULT
"What specific agricultural benefits does the BlueWave agrivoltaics project in Maine provide to the farmer and the land, beyond simply co-locating with solar?",ERROR_NO_RESULT
"How does the scale of the floating solar project in the Philippines compare to recent solar developments in Italy and Australia, and what does this say about global solar trends?",ERROR_NO_RESULT
"What are the key differences between the software solutions offered by FTC Solar (SUNOPS) and the grid modeling research at Oak Ridge National Lab, in terms of their immediate users and primary objectives?",ERROR_NO_RESULT
Contrast the battery chemistry and application focus of CMBlu Energy's Organic SolidFlow battery with the zinc-based systems mentioned in other news articles.,ERROR_NO_RESULT
"How do the safety considerations for large-scale grid batteries, as discussed by PNNL, relate to the safety advantages claimed by CMBlu for its Organic SolidFlow technology?",ERROR_NO_RESULT
What do the sales trends in Norway and Sweden indicate about the evolving consumer perception and practical reality of Plug-in Hybrid Electric Vehicles (PHEVs) in mature EV markets?,ERROR_NO_RESULT
"How does the Mercedes-Benz Concept CLA Class, with its 800V architecture and bidirectional charging, reflect the future integration of EVs with the electrical grid?",ERROR_NO_RESULT
"What are the primary criticisms of Plug-in Hybrid Electric Vehicles (PHEVs) like the Mitsubishi Outlander, and what arguments do manufacturers use to justify their continued place in the market?",ERROR_NO_RESULT
"How do the regulatory reviews in Iowa and the federal TSED grant program represent a ""top-down"" and ""bottom-up"" approach to enabling the energy transition?",ERROR_NO_RESULT
"What is the ""Justice40 Initiative"" and how is it being applied to federal funding for electric vehicles and transmission infrastructure?",ERROR_NO_RESULT
"Synthesizing the findings on sea-level rise and marine heat waves, how should policymakers approach climate adaptation planning given the uncertainties in scientific predictions?",ERROR_NO_RESULT
"How does the concept of ""green infrastructure"" for carbon-neutral cities, as studied in Europe, complement the technological approaches to decarbonization like renewable energy and EVs?",ERROR_NO_RESULT
"What evidence from the RMI report and the U.S. solar shipment data supports the idea that renewable energy is becoming ""irresistible"" from a purely economic standpoint?",ERROR_NO_RESULT
"How are public funding mechanisms like grants and loans, as seen in the Slovakian geothermal and U.S. EV manufacturing examples, designed to de-risk private investment in clean energy?",ERROR_NO_RESULT
How do the partnerships described in the Maine agrivoltaics project and the African e-mobility project highlight the importance of local knowledge in deploying successful clean technology solutions?,ERROR_NO_RESULT
"What is the significance of domestic manufacturing and supply chains for clean energy technologies, as highlighted in the contexts of U.S. solar, EV batteries, and Australian lithium?",ERROR_NO_RESULT
"How are batteries and energy storage positioned as a critical enabling technology across the sectors of grid reliability, transportation, and renewable energy integration?",ERROR_NO_RESULT
Contrast the primary energy challenges and solutions being implemented in a developed economy (like the U.S. or EU) with those in a developing context (like rural Africa).,ERROR_NO_RESULT
"How does the ""learning curve"" effect for renewable energy technologies, as described by RMI, create a positive feedback loop that accelerates the energy transition?",ERROR_NO_RESULT
"What role do corporate sustainability goals and ESG (Environmental, Social, and Governance) reporting play in driving the adoption of clean technologies, according to the interviews and reports?",ERROR_NO_RESULT
"How is the concept of a ""just transition"" addressed in the context of the U.S. EV manufacturing support and the Slovakian geothermal project?",ERROR_NO_RESULT
"What are the arguments for and against using carbon capture as a decarbonization strategy, as implied by the Burning Man controversy and the focus on renewable growth elsewhere?",ERROR_NO_RESULT
How does the development of a Megawatt Charging System (MCS) standard for electric trucks parallel the need for advanced grid modeling (EMT) discussed by Oak Ridge National Lab?,ERROR_NO_RESULT
"What is the significance of bidirectional charging in electric vehicles, and how does it transform the relationship between a vehicle and the energy grid?",ERROR_NO_RESULT
How do the discussions around grid planning in Iowa and California's Freight Infrastructure Planning initiative address the need for a more proactive approach to infrastructure upgrades?,ERROR_NO_RESULT
"Synthesizing information from the U.S. solar shipments, European renewable trends, and the RMI report, what is the global outlook for the solar energy industry in the next decade?",ERROR_NO_RESULT
How does the success of companies like Diverso Energy and Mobility for Africa demonstrate the importance of business model innovation in the cleantech sector?,ERROR_NO_RESULT
"What overarching lessons about a successful clean energy transition can be drawn from synthesizing the themes of technology, policy, and economics across all these articles?",ERROR_NO_RESULT
